{
  "protocol": 1,
  "type": "turn.credentials.result",
  "request_id": "11111111-1111-4111-8111-111111111111",
  "room_id": "TEST_ROOM_ID",
  "turn_uris": [
    "turn:example.invalid:3478?transport=udp"
  ],
  "username": "TEST_EXPIRES:TEST_MEMBER",
  "credential": "TEST_CREDENTIAL_ONLY",
  "expires_at": 1800000000
}
